"The Morgan case thus tells us much more about the current state of sex, class, race and politics in our society than it does about the facts of Dr. Morgan's particular situation.","The Morgan case thus tells us much more about the current state of sex, class, race and politics in our society than it does tell us about the facts of Dr. Morgan's particular situation."
"Paul and John were watching the news, and Mary a movie.","Paul and John were watching the news, and Mary was watching a movie."
"Marsh lifted his head and gasped out with mock courtliness, “Oh, he hasn’t, hasn’t he?","Marsh lifted his head and gasped out with mock courtliness, “Oh, he hasn’t been helped to the Irish stew, hasn’t he?"
"And before it does, they're trying to cut back on the clutter that created the situation in the first place.","And before it does have a noticeable effect on response rates, they're trying to cut back on the clutter that created the situation in the first place."
"Mary doesn't play softball, nor Susan volleyball.","Mary doesn't play softball, nor does Susan play volleyball."
"Both Dr. Mason and Dr. Sullivan oppose federal funding for abortion, as does President Bush, except in cases where a woman's life is threatened.","Both Dr. Mason and Dr. Sullivan oppose federal funding for abortion, as does President Bush oppose federal funding for abortion, except in cases where a woman's life is threatened."
Mr. Corry might have to dismember the company more than he wants to.,Mr. Corry might have to dismember the company more than he wants to dismember the company.
"To the extent they did, their concern was to ensure fiscal accountability.","To the extent they did discuss the appropriations clause, their concern was to ensure fiscal accountability."
"Yes, he did.","Yes, he did support the rights of the witnesses to take the Fifth Amendment."
"I want to try to begin to write a novel, and Mary to try to write a play.","I want to try to begin to write a novel, and Mary to try to begin to write a play."
He can't.,He can't knock off the Khmer Rouge.
You've either got a chair or you don't.,You've either got a chair or you don't got a chair.
"Frank grovels a little for the bookers, probably no more or less than he would have to if he worked for a big corporation.","Frank grovels a little for the bookers, probably no more or less than he would have to grovel a little for the bookers if he worked for a big corporation."
Tomorrow.,The circus starts tomorrow.
"Judy should have been fired, but I shouldn’t have been.","Judy should have been fired, but I shouldn’t have been fired."
"I stole a book, and Peter kisses from Mary.","I stole a book, and Peter stole kisses from Mary."
"Fed Chairman Greenspan said the central bank can wipe out inflation without causing a recession, but doing so will inflict short-term pain.","Fed Chairman Greenspan said the central bank can wipe out inflation without causing a recession, but wiping out inflation will inflict short-term pain."
I don’t know what.,I don't know what other matter my attention was directed to.
"Boober should have eaten, and Squeaker should, too.","Boober should have eaten, and Squeaker should eat, too."
"Those cuts, known as a ""sequester"" in budget jargon, became permanent yesterday, although Congress could cancel or rescind them whenever it wants to.","Those cuts, known as a ""sequester"" in budget jargon, became permanent yesterday, although Congress could cancel or rescind them whenever it wants to cancel or rescind them."
But most of them could have afforded to keep up their payments--they chose not to do so.,But most of them could have afforded to keep up their payments--they chose not to keep up their payments.
Say when.,Say when you will be back from the errand.
"And please, Michelle, when you sing the line in ""Makin' Whoopee,"" about another sunny, funny honeymoon, don't say ""funn-ih,"" the way Dylan would.","And please, Michelle, when you sing the line in ""Makin' Whoopee,"" about another sunny, funny honeymoon, don't say ""funn-ih,"" the way Dylan would say ""funn-ih""."
Experts say there isn't another state in the country where tests mean as much as they do in South Carolina.,Experts say there isn't another state in the country where tests mean as much as they do mean in South Carolina.
And neither can your pilot.,"And neither can your pilot steer."""
"Jeremy’s restraining order hasn’t already expired, has it?","Jeremy’s restraining order hasn’t already expired, has it already expired?"
"Now, apparently, they do.","Now, apparently, they do seek such assurance."
Mr. Bush has pledged as well to respect the 14-year-old executive order barring U.S. agents from assassinating foreign leaders or helping others to do so.,Mr. Bush has pledged as well to respect the 14-year-old executive order barring U.S. agents from assassinating foreign leaders or helping others to do assassinate foreign leaders.
I like tea and you coffee.,I like tea and you like coffee.
"She will high-five someone, but I don’t know who.","She will high-five someone, but I don’t know who she will high-five."
"While the network currently can operate freely in Budapest, so can others.","While the network currently can operate freely in Budapest, so can others operate freely in Budapest."
But even those numbers don't describe the situation as well as the athletes do in their own words.,But even those numbers don't describe the situation as well as the athletes do describe the situation in their own words.
"Goodwill planned to sell the property and pocket the proceeds, as it had in many similar cases.","Goodwill planned to sell the property and pocket the proceeds, as it had sold the property and pocketed the proceeds in many similar cases."
"She pointed out that even after Monday's 10% decline, the Straits Times index is up 24% this year, so investors who bailed out generally did so profitably.","She pointed out that even after Monday's 10% decline, the Straits Times index is up 24% this year, so investors who bailed out generally did bail out profitably."
"Sue likes pasta and Peter does, too.","Sue likes pasta and Peter does like pasta, too."
Encouragement is fine; compulsion is not.,Encouragement is fine; compulsion is not fine.
"For years, he quietly stuck to the back accounting rooms, wearing a hat to work because everyone else did.","For years, he quietly stuck to the back accounting rooms, wearing a hat to work because everyone else did wear a hat to work."
"In the long, frightening night after Tuesday's devastating earthquake, Bay Area residents searched for comfort and solace wherever they could.","In the long, frightening night after Tuesday's devastating earthquake, Bay Area residents searched for comfort and solace wherever they could searched for comfort and solace."
"She gave the dog a bone, and the man a flower.","She gave the dog a bone, and she gave the man a flower."
"We helped your friends, before we helped ours.","We helped your friends, before we helped our friends."
"But this year, when the hullabaloo surrounding its centennial died, so too did some advertiser interest.","But this year, when the hullabaloo surrounding its centennial died, so too did some advertiser interest die."
"Sophie barks at racoons in the morning, and Sophie at squirrels, too.","Sophie barks at racoons in the morning, and Sophie barks at squirrels in the morning, too."
"Maybe after the staffers explain their work to the Poles, they'd be willing to come back and do the same for the American people.","Maybe after the staffers explain their work to the Poles, they'd be willing to come back and do the same explain their work for the American people."
He also had to fight harder for credibility than his partner did.,He also had to fight harder for credibility than his partner did fight for credibility.
"Then at 10:15 the Dow suddenly started to rebound, and when it shot upward it did so even faster than the early-morning fall.","Then at 10:15 the Dow suddenly started to rebound, and when it shot upward it did shoot upward even faster than the early-morning fall."
"Sam said that they spoke German, and Charlene Spanish.","Sam said that they spoke German, and Charlene said that they spoke Spanish."
"And any strong surge in redemptions could force some funds to dump stocks to raise cash, as some did during Black Monday.","And any strong surge in redemptions could force some funds to dump stocks to raise cash, as some did dump stocks to raise cash during Black Monday."
"They want to hire someone who speaks a Balkan language, but I don’t remember which.","They want to hire someone who speaks a Balkan language, but I don’t remember which Balkan language."
"Lauren can play the guitar and Mike can, too.","Lauren can play the guitar and Mike can play the guitar, too."
"It's not that we don't know how to, because we do.","It's not that we don't know how to teach our children to read, write and reckon, because we do know how to teach our children to read, write and reckon."
"John always tried to finish reading a book in the evening, and Mary a newspaper.","John always tried to finish reading a book in the evening, and Mary always tried to finish reading a newspaper in the evening."
"Lauren can play something, but I don’t know what.","Lauren can play something, but I don’t know what Lauren can play."
"Max seemed to be trying to begin to love Harriet, and Fred Sue.","Max seemed to be trying to begin to love Harriet, and Fred to be trying to begin to love Sue."
"When WCRS created Della Femina McNamee out of the merger of three smaller agency units in 1988, it said it did so in order to attract larger clients, especially packaged-goods companies.","When WCRS created Della Femina McNamee out of the merger of three smaller agency units in 1988, it said it did create Della Femina McNamee in order to attract larger clients, especially packaged-goods companies."
"And don’t you look when Jim unloads the pan — something might happen, I don’t know what.","And don’t you look when Jim unloads the pan — something might happen, I don’t know what might happen."
"Every linguist argued with a philosopher who took issue with one of his claims, but I can’t remember which one of his claims.","Every linguist argued with a philosopher who took issue with one of his claims, but I can’t remember which one of his claims the philosopher took issue with."
"The department is advising residents to plant Sagos, if they must, in the back yard and telling nurseries to be on the lookout for anyone trying to palm one off.","The department is advising residents to plant Sagos, if they must plant Sagos, in the back yard and telling nurseries to be on the lookout for anyone trying to palm one off."
"Now it has --especially for people my age.""","Now it has become an issue--especially for people my age."""
"Some TV people doubt they will materialize and argue that even if they do, they won't offset the multimillion-dollar deficits that CBS could run up.","Some TV people doubt they will materialize and argue that even if they do materialize, they won't offset the multimillion-dollar deficits that CBS could run up."
"""There is no question that the situation is bad, but we may be painting a gloomier picture than we should,"" he said.","""There is no question that the situation is bad, but we may be painting a gloomier picture than we should paint a picture,"" he said."
"Sam doesn't play sousaphone, nor Medusa sarrussophone.","Sam doesn't play sousaphone, nor does Medusa play sarrussophone."
Soviet leaders said they would support their Kabul clients by all means necessary--and did.,Soviet leaders said they would support their Kabul clients by all means necessary--and they did support their Kabul clients.
"Federal Reserve Chairman Alan Greenspan told Congress that the Fed can wipe out inflation without causing a recession, but he said doing so will inflict some short-term pain and will require reducing the federal deficit sharply.","Federal Reserve Chairman Alan Greenspan told Congress that the Fed can wipe out inflation without causing a recession, but he said wiping out inflation will inflict some short-term pain and it will require reducing the federal deficit sharply."
"Some American officers interpreted his eagerness and studiousness as a sign of loyalty, but they did so falsely.","Some American officers interpreted his eagerness and studiousness as a sign of loyalty, but they did interpret his eagerness and studiousness falsely."
"If these speculators can't afford to trade as actively as before, stock-index futures prices, and therefore stock prices, may have to fall further than they might otherwise to attract buyers.","If these speculators can't afford to trade as actively as before, stock-index futures prices, and therefore stock prices, may have to fall further than they might otherwise fall to attract buyers."
He asked why.,He asked why is seemed a strange name for an angel.
"Adults under age 30 like sports cars, luxury cars, convertibles and imports far more than their elders do.","Adults under age 30 like sports cars, luxury cars, convertibles and imports far more than their elders do like sports cars, luxury cars, convertibles and imports."
I caught the first train before you caught the second.,I caught the first train before you caught the second train.
"However, most people, having been subjected to news footage of the devastated South Bronx, look at the borough the way Tom Wolfe's Sherman McCoy did in ""Bonfire of the Vanities""--as a wrong turn into hell.","However, most people, having been subjected to news footage of the devastated South Bronx, look at the borough the way Tom Wolfe's Sherman McCoy did look in ""Bonfire of the Vanities""--as a wrong turn into hell."
And ad agencies insist that they do.,And ad agencies insist that they do work.
"The company had been experiencing softening margins because of increased sales of software applications, which have lower margins than do operating systems.","The company had been experiencing softening margins because of increased sales of software applications, which have lower margins than do operating systems have margins."
"John can play something, but I don’t know what.","John can play something, but I don’t know what he can play."
"If it doesn't, he says, the company would have to change its expansion timetable.","If it doesn't succeed, he says, the company would have to change its expansion timetable."
"Barry could be drinking, but he shouldn’t be.","Barry could be drinking, but he shouldn’t be drinking."
"The LME stocks decline was about as expected, but the Comex gain wasn't.","The LME stocks decline was about as expected, but the Comex gain wasn't expected."
What this all means in shorthand is that Soviet dominance in Ethiopia is collapsing as fast as President Barre's regime in Somalia is.,What this all means in shorthand is that Soviet dominance in Ethiopia is collapsing as fast as President Barre's regime in Somalia is collapsing.
"TW notes, as many junk issuers do, that ""adjusted to eliminate non-cash charges"" TW would have run a cash surplus--in this case, of $56 million over six months.","TW notes, as many junk issuers do note, that ""adjusted to eliminate non-cash charges"" TW would have run a cash surplus--in this case, of $56 million over six months."
Some bourbon makers advertise abroad as they do at home.,Some bourbon makers advertise abroad as they do advertise at home.
Either one likes it or one doesn't.,Either one likes it or one doesn't like it.
"And then, asset values of the funds could plunge more than they have so far.","And then, asset values of the funds could plunge more than they have plunged so far."
John hasn't read the book but Peter has.,John hasn't read the book but Peter has read the book.
"By 1982, however, the patent status of the Lanier microcassette had changed, permitting Dictaphone to develop its own competitive micro system, which it did.","By 1982, however, the patent status of the Lanier microcassette had changed, permitting Dictaphone to develop its own competitive micro system, which it did develop."
The government includes money spent on residential renovation; Dodge doesn't.,The government includes money spent on residential renovation; Dodge doesn't include money spent on residential renovation.
"With her keen on him, and him on her, the party should be fun.","With her keen on him, and him keen on her, the party should be fun."
"His wife also works for the paper, as did his father.","His wife also works for the paper, as did his father work for the paper."
"Late Thursday, the Treasury said it needed to raise $17 billion quickly and would do so by issuing new securities this week.","Late Thursday, the Treasury said it needed to raise $17 billion quickly and would do raise $17 billion by issuing new securities this week."
"Neil Kinnock, Labor Party leader, dubbed the 46-year-old Mr. Major a ""lap dog"" unlikely to veer from his boss's strongly held views, as Mr. Lawson sometimes did.","Neil Kinnock, Labor Party leader, dubbed the 46-year-old Mr. Major a ""lap dog"" unlikely to veer from his boss's strongly held views, as Mr. Lawson sometimes did veer from his boss's strongly held views."
"While the promises of big profits ought to set off warning bells, they often don't, in part because get-rich-quick tales have become embedded in American folklore.","While the promises of big profits ought to set off warning bells, they often don't set off warning bells, in part because get-rich-quick tales have become embedded in American folklore."
The banks have 28 days to file an appeal against the ruling and are expected to do so shortly.,The banks have 28 days to file an appeal against the ruling and the banks are expected to do file an appeal against the ruling shortly.
"Supporters of index arbitrage haven't been publicly sticking up for the trading strategy, as some did during the post-crash outcry of 1987.","Supporters of index arbitrage haven't been publicly sticking up for the trading strategy, as some did stick up for the trading strategy during the post-crash outcry of 1987."
"The only fly in the Soviet ointment was the last-minute addition of a unilateral American caveat, that U.S. aid to the resistance would continue as long as Soviet aid to Kabul did.","The only fly in the Soviet ointment was the last-minute addition of a unilateral American caveat, that U.S. aid to the resistance would continue as long as Soviet aid to Kabul did continue."
John can.,John can go to the store.
"Jim has been observed by me, and Tom by you.","Jim has been observed by me, and Tom has been observed by you."
"He insisted, as he has before, that creditors would be paid in full under the plan.","He insisted, as he has insisted before, that creditors would be paid in full under the plan."
"One analyst noted that the company often has better store locations than do its franchisees, thus aiding promotional efforts.","One analyst noted that the company often has better store locations than do its franchisees have, thus aiding promotional efforts."
"If the University had actually known it was those three, it would for very consistency's sake have told how it knew it, and not stopped with the mere assertion.","If the University had actually known it was those three, it would for very consistency's sake have told how it knew it was those three, and not stopped with the mere assertion that it was those three."
This damn crossword.,I have been trying to accomplish this damn crossword.
Lauren can play the guitar better than Mike the violin.,Lauren can play the guitar better than Mike can play the violin.
"So does Mr. Friend and his law partner, Nick Nichols.","So does Mr. Friend and his law partner, Nick Nichols get to cuff Mr. Alexander."
"Sue is hungry and Peter is, too.","Sue is hungry and Peter is hungry, too."
The pro-choice lobby doesn't.,The pro-choice lobby doesn't favor parental consent for teen-age abortions.
"Mr. Wertheimer said the Senate Ethics Committee should hire a special outside counsel to conduct an investigation, as was done in the case of former House Speaker James Wright.","Mr. Wertheimer said the Senate Ethics Committee should hire a special outside counsel to conduct an investigation, as a special outside counsel was was hired in the case of former House Speaker James Wright."
"But as astounding as the changes that have already occurred are, there is a fragility to glasnost.","But as astounding as the changes that have already occurred are astounding, there is a fragility to glasnost."
"Barry could be drinking by now, couldn’t he be?","Barry could be drinking by now, couldn’t he be drinking?"
She will sell sea shells and he will too.,She will sell sea shells and he will sell sea shells too.
"Lauren can play the guitar, and Mike the violin.","Lauren can play the guitar, and Mike can play the violin."
Why?,Why ought the pillory to be abolished?
Fred's.,Fred's house is too big
You either believe Seymour can do it again or you don't.,You either believe Seymour can do it again or you don't believe Seymour can do it again.
Eve gave a CD to Al and roses to Sue.,Eve gave a CD to Al and gave roses to Sue.
"Lauren can play the guitar, but not Mike.","Lauren can play the guitar, but Mike cannot play the guitar."
"In addition, further packaging of mortgage-backed securities, such as Blackstone's fund, have reduced the effects of prepayment risk and automatically reinvest monthly payments so institutions don't have to.","In addition, further packaging of mortgage-backed securities, such as Blackstone's fund, have reduced the effects of prepayment risk and automatically reinvest monthly payments so institutions don't have to reinvest monthly payments."
"I heard Mary's dog, and you heard Bill's.","I heard Mary's dog, and you heard Bill's dog."
Me!,Me wants a slice a pizza!
"""Gold still acts as a haven when uncertainty prevails in the financial markets as it did "" yesterday, she said.","""Gold still acts as a haven when uncertainty prevails in the financial markets as it did prevail"" yesterday, she said."
"But car-happy Americans panicked, and so did the U.S. and other oil-consuming governments.","But car-happy Americans panicked, and so did the U.S. panik and other oil-consuming governments panik."
"Should I do it, or you?","Should I do it, or should you do it?"
This story line might resonate more strongly if Mr. Lane had as strong a presence in front of the camera as he does behind it.,This story line might resonate more strongly if Mr. Lane had as strong a presence in front of the camera as he does have as strong a presence behind it.
Pro-.,Pro-communist.
"Major oil companies in the next few days are expected to report much less robust earnings than they did for the third quarter a year ago, largely reflecting deteriorating chemical prices and gasoline profitability.","Major oil companies in the next few days are expected to report much less robust earnings than they did report earnings for the third quarter a year ago, largely reflecting deteriorating chemical prices and gasoline profitability."
"I could go shopping in the morning, but in the afternoon I could not.","I could go shopping in the morning, but in the afternoon I could not go shopping."
Sviatslav is pro-communist and Derzhinsky is anti-.,Sviatslav is pro-communist and Derzhinsky is anti-communist.
She saw three monkeys and he saw two.,She saw three monkeys and he saw two monkeys.
Ther’s six candles gone—that’s what.,Ther’s six candles gone—that’s what else is gone.
They did not say why.,They did not say why to remain at St. Denis.
"Yesterday, Joel Zweibel, an attorney for Eastern's creditors committee, declined to comment on whether the experts had ever been instructed to look at other choices and whether they now were asked not to.","Yesterday, Joel Zweibel, an attorney for Eastern's creditors committee, declined to comment on whether the experts had ever been instructed to look at other choices and whether they now were asked not to look at other choices."
"If you don't, you can't do your job.","If you don't accept all the suffering people are going through, you can't do your job."
That I ignored you.,I am ashamed that I ignored you.
"His allotment of materials also did, until the state couldn't hold up its end of that bargain.","His allotment of materials also did depend on how much produce he sells the state, until the state couldn't hold up its end of that bargain."
"Yes, I will.","Yes, I will come back from the errand."
"Oh, am I dreaming? Am I drunk—or is my hearing playing me false? Why, I would rather go to — never mind where.","Oh, am I dreaming? Am I drunk—or is my hearing playing me false? Why, I would rather go to — never mind where I would rather go."
Tom could see Lee but Mary could not.,Tom could see Lee but Mary could not see Lee.
"Broke his arm — very likely, ain’t it — and very convenient, too, for a fraud that’s got to make signs, and ain’t learnt how.","Broke his arm — very likely, ain’t it — and very convenient, too, for a fraud that’s got to make signs, and ain’t learnt how to make signs."
"Try as they might, the Communists could neither replace nor break him.","Try as they might to replace nor break him, the Communists could neither replace nor break him."
"The local government is discredited in the eyes of many residents for a variety of reasons, and congressmen read the same newspapers and watch the same TV newscasts as other people in the area do.","The local government is discredited in the eyes of many residents for a variety of reasons, and congressmen read the same newspapers and watch the same TV newscasts as other people in the area do watch the same TV newscasts."
