The growth of Las Vegas tourism in recent years persuades lenders that they will.,The growth of Las Vegas tourism in recent years persuades lenders that they will pay off.
"He laughs too much, and you too.","He laughs too much, and you laugh too much too."
"It never hurt anyone, that is, unless the growth funds don't grow when you need them to.","It never hurt anyone, that is, unless the growth funds don't grow when you need them to grow."
Each student was helped so that each would understand.,Each student was helped so that each student would understand.
"Why, she tried to learn you your book, she tried to learn you your manners, she tried to be good to you every way she knowed how.","Why, she tried to learn you your book, she tried to learn you your manners, she tried to be good to you every way she knowed how to be good."
"""I really do,"" she says.","""I really do owe that constructor,"" she says."
"Boober should have eaten, and Squeaker should’ve, too.","Boober should have eaten, and Squeaker should’ve eaten, too."
"I attend, and so does a television crew from New York City.","I attend, and so does attend a television crew from New York City."
He hasn't yet done so.,He hasn't yet exempted military personnel accounts from the spending cuts.
Mary wants to buy a book and Jenny a CD.,Mary wants to buy a book and Jenny wants to buy a CD.
"Carrie gave a set of directions to me, and Will a map.","Carrie gave a set of directions to me, and Will gave a map to me."
"I do not go one single cent on burglar alarms, Mr. Twain--not a single cent--and I will tell you why.","I do not go one single cent on burglar alarms, Mr. Twain--not a single cent--and I will tell you why I do not go one single cent on burglar alarms."
"Most dogs can smell fear, can they not?","Most dogs can smell fear, can they not smell fear?"
"""Shippers are saying `the party's over, '"" said Mr. LaLonde. ""Shippers won't be able to look for transportation-cost savings as they have for the last eight or nine years.","""Shippers are saying `the party's over, '"" said Mr. LaLonde. ""Shippers won't be able to look for transportation-cost savings as they have looked for transportation-cost savings for the last eight or nine years."
"""Auto prices had a big effect in the PPI, and at the CPI level they won't,"" he said.","""Auto prices had a big effect in the PPI, and at the CPI level they won't have a big effect,"" he said."
"The guitarist hid behind the curtain suddenly, and the singer behind the stage.","The guitarist hid behind the curtain suddenly, and the singer hid behind the stage."
The U.S. said it would fully support the resistance--and didn't.,The U.S. said it would fully support the resistance--and they didn't fully support the resistance.
Sounds great--or does it?,Sounds great--or does it sound great?
"However, Mr. Smith said that as a result of a $70 billion factory-modernization program undertaken over the last decade, ""we can produce more in the new plants than we could in the old plants.""","However, Mr. Smith said that as a result of a $70 billion factory-modernization program undertaken over the last decade, ""we can produce more in the new plants than we could produce in the old plants."""
"John didn’t go to the wedding, but Karen did.","John didn’t go to the wedding, but Karen did go to the wedding."
"MARKET MOVES, these managers don't.","MARKET MOVES, these managers don't move."
"Susan works at night, and Bill too.","Susan works at night, and Bill works at night too."
"Mr. Good, who documents these things as best he can, provides an official explanation in the form of a memorandum from Chief of Staff George C. Marshall to President Roosevelt: ""1,430 pounds of ammunition,"" he wrote his commander in chief, were expended on ""unidentified aircraft,"" flying at speeds as slow as 200 mph and elevations between 9,000 and 18,000 feet.","Mr. Good, who documents these things as best he can document these things, provides an official explanation in the form of a memorandum from Chief of Staff George C. Marshall to President Roosevelt: ""1,430 pounds of ammunition,"" he wrote his commander in chief, were expended on ""unidentified aircraft,"" flying at speeds as slow as 200 mph and elevations between 9,000 and 18,000 feet."
Dow Jones is not going to squeeze as hard as it could.,Dow Jones is not going to squeeze as hard as it could squeeze.
"No light there; the house all dark—which made me feel sorry and disappointed, I didn’t know why.","No light there; the house all dark—which made me feel sorry and disappointed, I didn’t know why it made me feel sorry and disappointed."
I couldn't talk with her as I would with someone who had a lot of vocal training.,I couldn't talk with her as I would talk with someone who had a lot of vocal training.
"Pizza Hole is being inspected, but Crab4U isn’t.","Pizza Hole is being inspected, but Crab4U isn’t being inspected."
"Moreover, they note, those who manage to pay their own way often do so only by selling their homes, using up life savings or drawing heavily on children and other relatives.","Moreover, they note, those who manage to pay their own way often do manage to pay their own way only by selling their homes, using up life savings or drawing heavily on children and other relatives."
"Will Jimmy greet Jill first, or Jill Jimmy?","Will Jimmy greet Jill first, or will Jill greet Jimmy first?"
I want to try to begin to write a novel and Mary to begin to write a play.,I want to try to begin to write a novel and Mary wants to try to begin to write a play.
"John always tried to finish reading a book in the evening, and Mary a newspaper.","John always tried to finish reading a book in the evening, and Mary always tried to finish reading a newspaper."
"Because you bought two donuts, I bought three.","Because you bought two donuts, I bought three donuts."
"He can swim, and she can, too.","He can swim, and she can swim, too."
"She asked the kids to stay, and the adults too.","She asked the kids to stay, and she asked the adults to stay too."
"Susana did not read War and Peace, but Maria did.","Susana did not read War and Peace, but Maria did read War and Peace."
"When he came to Applied, ""I didn't have the power to execute as I do today,"" he says.","When he came to Applied, ""I didn't have the power to execute as I do execute today,"" he says."
"Investors can get slightly higher yields on deposits below $50,000 than they can on deposits of $90,000 and up.","Investors can get slightly higher yields on deposits below $50,000 than they can get yields on deposits of $90,000 and up."
"If it had been, he mighta hit it out.","If it had been a strike, he mighta hit it out."
But a secondary agenda among officials in the City of Angels was to learn about the disaster-contingency plans that work and those that don't.,But a secondary agenda among officials in the City of Angels was to learn about the disaster-contingency plans that work and those that don't work.
"I know which book Max read, and Oscar did.","I know which book Max read, and which book Oscar did read."
He isn't as well-known to clients as is Mr. Roman.,He isn't as well-known to clients as is Mr. Roman well-known to clients.
It's a tough thing when you can't.,It's a tough thing when you can't turn things around.
But will it?,But will it go toward these noble goals?
"Never once — just set there gazing with all his eyes at something else, I couldn’t tell what.","Never once — just set there gazing with all his eyes at something else, I couldn’t tell what he was gazing at."
I ignored you.,I am ashamed I ignored you.
"Punching away, we raised what I still think were all the right issues and landed more than one hard blow, but at the end of the affair, there was just the tiniest nagging worry that we had been aiming at the wrong target.","Punching away, we raised what I still think were all the right issues and we landed more than one hard blow, but at the end of the affair, there was just the tiniest nagging worry that we had been aiming at the wrong target."
"But even if he agrees, Mr. Kemp doesn't write the nation's housing law--Congress does.","But even if he agrees, Mr. Kemp doesn't write the nation's housing law--Congress does write the nation's housing law."
"The quarter net was below analyst expectations mainly because truck-parts sales didn't rebound in September from the summer doldrums as they usually do, said Patrick E. Sheridan, analyst with McDonald & Co.","The quarter net was below analyst expectations mainly because truck-parts sales didn't rebound in September from the summer doldrums as they usually do rebound, said Patrick E. Sheridan, analyst with McDonald & Co."
"The net interest margin--the difference between the bank's cost of funds and what it receives as interest payments--improved in the quarter, as did certain areas of wholesale banking.","The net interest margin--the difference between the bank's cost of funds and what it receives as interest payments--improved in the quarter, as did certain areas of wholesale banking improve."
Teddy will.,Teddy will eat the apple.
"Dozens of small companies did, swiftly establishing a standard operating system.","Dozens of small companies did copy it, swiftly establishing a standard operating system."
"Sam likes his apple pie with vanilla ice cream, but Alex likes his with whipped cream.","Sam likes his apple pie with vanilla ice cream, but Alex likes his apple pie with whipped cream."
"A daily news briefing from the company librarian, for example, would have a distinctive format on the screen, just as a paper version would have.","A daily news briefing from the company librarian, for example, would have a distinctive format on the screen, just as a paper version would have a distinctive format on the screen."
"Although Philip Morris typically tries to defend the rights of smokers with free-choice arguments, ""this has nothing to do with cigarettes, nor will it ever,"" the spokesman says.","Although Philip Morris typically tries to defend the rights of smokers with free-choice arguments, ""this has nothing to do with cigarettes, nor will it ever have anything to do with cigarettes,"" the spokesman says."
"Many Japanese think it only natural that the organizations or their members would donate to politicians, the way many Japanese do, to win favor or support.","Many Japanese think it only natural that the organizations or their members would donate to politicians, the way many Japanese donate to politicians, to win favor or support."
"You understand, the University decided emphatically that it was fiends who spoke in those Voices; it would need to prove that, and it did.","You understand, the University decided emphatically that it was fiends who spoke in those Voices; it would need to prove that it was fiends who spoke in those Voices, and it did prove that it was fiends who spoke in those Voices."
They didn't.,They didn't hold off.
Uncle John doesn’t have a spouse but uncle Bill does and she is very nice.,Uncle John doesn’t have a spouse but uncle Bill does have a spouse and she is very nice.
"How soon Wang will stage a comeback, or if it will at all, are still matters of debate.","How soon Wang will stage a comeback, or if it will at all stage a comeback, are still matters of debate."
"I believe we have to take a shot at getting as much done as we can through the court, through Justice and through state and federal regulatory agencies.","I believe we have to take a shot at getting as much done as we can get done through the court, through Justice and through state and federal regulatory agencies."
It's that we don't want to.,"It's that we don't want to teach our children to read, write and reckon."
Jorge thought he kissed everyone that Kevin did.,Jorge thought he kissed everyone that Kevin did kiss.
"Congress closed this loophole last year, or thought it did.","Congress closed this loophole last year, or thought it did clos this loophole last year."
"If the political establishment is reluctant to forgive sexual misadventures, the private sector sometimes will.","If the political establishment is reluctant to forgive sexual misadventures, the private sector sometimes will forgive sexual misadventures."
Susan Larry.,Susan wants to marry Larry.
But even that group knows some people don't use their machines as much as they should.,But even that group knows some people don't use their machines as much as they should use their machines.
"John has written the words, and Paul the music.","John has written the words, and Paul has written the music."
"When bank financing for the buy-out collapsed last week, so did UAL's stock.","When bank financing for the buy-out collapsed last week, so did UAL's stock collapse last week."
"John likes tea, and Mary coffee.","John likes tea, and Mary likes coffee."
"It is thought to be some other sin, but none wit what.","It is thought to be some other sin, but none wit what other sin it is thought to be."
My dog.,I am forcing my dog to eat cat food.
"I want to try to begin to write a novel, and Mary to try to begin a play.","I want to try to begin to write a novel, and Mary to try to begin to write a play."
We've demonstrated that you can.,We've demonstrated that you can modify the immune response of an infected individual.
"Bob found a plumber who fixed the sink, but I’m not sure with what.","Bob found a plumber who fixed the sink, but I’m not sure with what the plumber fixed the sink."
"Traditional no-loads made their money by charging an annual management fee, usually a modest one; they imposed no other fees, and many still don't.","Traditional no-loads made their money by charging an annual management fee, usually a modest one; they imposed no other fees, and many still don't impose other fees."
"The stock market reacted as Mr. Rahn did, crumbling as it absorbed the news that Mr. Darman's strategy had been abandoned.","The stock market reacted as Mr. Rahn did react, crumbling as it absorbed the news that Mr. Darman's strategy had been abandoned."
Anne arrived before three and Susi left after four o’clock yesterday.,Anne arrived before three o’clock yesterday and Susi left after four o’clock yesterday.
"You know what the law of averages is, don't you?","You know what the law of averages is, don't you know what the law of averages is?"
"So why does Renaissance's computer like stocks with the Dow at 2653.28, where it closed yesterday, when it didn't with the Dow at 2200?","So why does Renaissance's computer like stocks with the Dow at 2653.28, where it closed yesterday, when it didn't like stocks with the Dow at 2200?"
Some have high-fived Daniel and others Ben.,Some have high-fived Daniel and others have high-fived Ben.
"Ben might shower, but Jack can’t, and Austin can’t get dressed.","Ben might shower, but Jack can’t shower, and Austin can’t get dressed."
"Mister Ed couldn’t read, could he?","Mister Ed couldn’t read, could he read?"
"If Brazil devises an economic strategy allowing it to resume growth and service debt, this could lead it to open up and deregulate its sheltered economy, analysts say, just as Argentinian President Carlos Saul Menem has been doing even though he was elected on a populist platform.","If Brazil devises an economic strategy allowing it to resume growth and service debt, this could lead it to open up and deregulate its sheltered economy, analysts say, just as Argentinian President Carlos Saul Menem has been devising an economic strategy even though he was elected on a populist platform."
"Now, Ben Rogers, do you want to do things regular, or don’t you?","Now, Ben Rogers, do you want to do things regular, or don’t you want to do things regular?"
"Under that approach, countries with the most unused oil capacity would get bigger shares of any future increases in OPEC's production ceiling than they would under the current system.","Under that approach, countries with the most unused oil capacity would get bigger shares of any future increases in OPEC's production ceiling than they would get shares under the current system."
I visited everyone who you did.,I visited everyone who you did visit.
"The typical Glass audience, which is more likely to be composed of music students than their teachers, certainly does.","The typical Glass audience, which is more likely to be composed of music students than their teachers, certainly does like it."
Like which are droppable and which are not.,Like which are droppable and which are not droppable.
I will bake the first batch of chocolate-chip cookies if you bake the second.,I will bake the first batch of chocolate-chip cookies if you bake the second batch of chocolate-chip cookies.
"I used to drink German beer, but I only drink Spanish now.","I used to drink German beer, but I only drink Spanish beer now."
"Moreover, ticket splitting appears to take the same peculiar pattern at the state government level as it does at the federal level.","Moreover, ticket splitting appears to take the same peculiar pattern at the state government level as it does take a peculiar pattern at the federal level."
"But Mr. Lane said that while the SEC regulates who files, the law tells them when to do so.","But Mr. Lane said that while the SEC regulates who files, the law tells them when to do file."
"He goes to school, and she does, too.","He goes to school, and she does go to school, too."
They will do it if they want to.,They will do it if they want to do it.
"I want to try to begin to write a novel, and Mary to write a play.","I want to try to begin to write a novel, and Mary to try to begin to write a play."
Lauren can play the guitar better than Mike.,Lauren can play the guitar better than Mike.
"Lauren can play the guitar, and Mike, too.","Lauren can play the guitar, and Mike can play the guitar, too."
"Retailers' sales increased 0.7%, as did their inventories.","Retailers' sales increased 0.7%, as did their inventories increase."
"He is singing, and she is, too.","He is singing, and she is singing, too."
"The Li family could apply for permission to do so, but hasn't tried.","The Li family could apply for permission to do quit to find jobs elsewhere, but hasn't tried."
"Things were supposed to change when Vietnam's economic reforms gathered pace, and for awhile they did.","Things were supposed to change when Vietnam's economic reforms gathered pace, and for awhile they did gather pace."
"Some people like broccoli, but many don't.","Some people like broccoli, but many people don't like broccoli."
"""France opened the limit down, off at least 10% if you could calculate the index, which you couldn't,"" Mr. Clark, the Shearson trader, said early in the afternoon. ""Spain is down 10% and suspended, Sweden's down 8%, Norway 11%.","""France opened the limit down, off at least 10% if you could calculate the index, which you couldn't calculate,"" Mr. Clark, the Shearson trader, said early in the afternoon."
Of course it was.,Of course it was a frivolous case.
I feel about Sassy like I did about Working Woman 10 years ago.,I feel about Sassy like I did feel about Working Woman 10 years ago.
Jewelry makers rarely pay commissions and aren't expected to anytime soon.,Jewelry makers rarely pay commissions and aren't expected to pay commissions anytime soon.
The U.S.S.R. would prolong a suspension of arms shipments to Nicaragua after the February election if the U.S. did likewise with its allies in Central America.,The U.S.S.R. would prolong a suspension of arms shipments to Nicaragua after the February election if the U.S. did likewise prolong a suspension of arms shipments with its allies in Central America.
Or ever will.,Or ever will see.
"I read the story about elves, and you about dwarves.","I read the story about elves, and you read the story about dwarves."
"He beer, and she orders wine.","He orders beer, and she orders wine."
He did not go as far as he could have in tax reductions; indeed he combined them with increases in indirect taxes.,He did not go as far as he could have gone in tax reductions; indeed he combined them with increases in indirect taxes.
"""What this means is that Europeans will have these machines in their offices before Americans do,"" the spokesman said.","""What this means is that Europeans will have these machines in their offices before Americans will have these machines in their offices,"" the spokesman said."
"Dean Steinkuhler, a spectacularly bulked-up former lineman, confesses that he used 'em, and says other Huskers did too.","Dean Steinkuhler, a spectacularly bulked-up former lineman, confesses that he used 'em, and says other Huskers did use 'em too."
"But Peter Brody, Magnascreen's president, says Japanese companies are poised to snatch the technology and put it to commercial use, just as they did with earlier U.S. innovations in color television and video recording.","But Peter Brody, Magnascreen's president, says Japanese companies are poised to snatch the technology and put it to commercial use, just as they did snatch the technology and put it to commercial use with earlier U.S. innovations in color television and video recording."
"John drank a tea, and Mary a coffee.","John drank a tea, and Mary drank a coffee."
"If he needed a screwdriver, I reckoned I knowed why.","If he needed a screwdriver, I reckoned I knowed why he needed a screwdriver."
"China might stave off a crisis if it acts as forcefully as it did to arrest the 1985 decline, when Beijing slammed the brakes on foreign-exchange spending and devalued the currency.","China might stave off a crisis if it acts as forcefully as it did act to arrest the 1985 decline, when Beijing slammed the brakes on foreign-exchange spending and devalued the currency."
I'll show you how.,"I'll show you how to be sole into slavery, en in a year buy yo' ole mammy free ag'in."
"No, about foreign policy.","No, each candidate will talk about foreign policy."
But a spokesman said the quake won't have as big a financial impact on Allstate as Hurricane Hugo did.,But a spokesman said the quake won't have as big a financial impact on Allstate as Hurricane Hugo did have as big a financial impact on Allstate.
"Dark hints would be raised that parts of the administration hope Mr. Gorbachev would fail, just as they were when Vice President Quayle voiced similar sentiments.","Dark hints would be raised that parts of the administration hope Mr. Gorbachev would fail, just as they were raised when Vice President Quayle voiced similar sentiments."
"""I think the market had been expecting the Fed to ease sooner and a little more than it has to date,"" said Robert Johnson, vice president of global markets for Bankers Trust Co.","""I think the market had been expecting the Fed to ease sooner and the market had been expecting the Fed to ease a little more than it has to date,"" said Robert Johnson, vice president of global markets for Bankers Trust Co."
"Warner and Mr. Azoff declined comment, as did MCA, where Mr. Azoff had also been discussing such a venture.","Warner and Mr. Azoff declined comment, as did MCA decline comment, where Mr. Azoff had also been discussing such a venture."
"It probably would, because few or none of the people upset by Mr. Mason's remarks have bothered to distinguish between the substance of his comments and the fact that he used insulting language.","It probably would be so hot, because few or none of the people upset by Mr. Mason's remarks have bothered to distinguish between the substance of his comments and the fact that he used insulting language."
"If it does, the operation would be one of the largest foreign purchases of a U.K merchant bank.","If it does bid for all of Morgan Grenfell, the operation would be one of the largest foreign purchases of a U.K merchant bank."
Eve gave flowers to Al and Sue to Paul.,Eve gave flowers to Al and Sue flowers to Paul.
"Ah, but he will.","Ah, but he will vote for the corrupt measure."
Susan likes her big red fish with a stripe and Tom likes his with spots.,Susan likes her big red fish with a stripe and Tom likes his big red fish with spots.
"Sam has done the work, and Bill, too.","Sam has done the work, and Bill has done the work, too."
"Beth’s wedding was in Bond Chapel, and Rachel’s was in Rockefeller Chapel.","Beth’s wedding was in Bond Chapel, and Rachel’s wedding was in Rockefeller Chapel."
"Juan read War and Peace, but I think that Pedro did not.","Juan read War and Peace, but I think that Pedro did not read War and Peace."
"If President Bush loses at the court, it might be disappointing, as Morrison v. Olson was for the Reagan administration.","If President Bush loses at the court, it might be disappointing, as Morrison v. Olson was disappointing for the Reagan administration."
"On average in the latest nine months, company-operated units in the U.S. had $90,552 more in sales than did franchised outlets.","On average in the latest nine months, company-operated units in the U.S. had $90,552 more in sales than did franchised outlets have."
"Mary and Susan read a book right now, and Peter a newspaper.","Mary and Susan read a book right now, and Peter reads a newspaper."
"Mr. Roderick did so by having USX redeem a series of guaranteed notes, a move that, in effect, raised the cost of a $7.19 billion Icahn bid by about $3 billion.","Mr. Roderick did adroitly dodged Mr. Icahn's first bullet by having USX redeem a series of guaranteed notes, a move that, in effect, raised the cost of a $7.19 billion Icahn bid by about $3 billion."
"Even if baseball triggers losses at CBS--and he doesn't think it will --""I'd rather see the games on our air than on NBC and ABC,"" he says.","Even if baseball triggers losses at CBS--and he doesn't think it will trigger losses--""I'd rather see the games on our air than on NBC and ABC,"" he says."
