"Moreover, the Japanese government, now the world's largest aid donor, is pumping far more assistance into the region than the U.S. is.","Moreover, the Japanese government, now the world's largest aid donor, is pumping far more assistance into the region than the U.S. is pumping into the region."
Environmental concerns are beginning to have as much influence in oil-industry spending plans as the price of crude does.,Environmental concerns are beginning to have as much influence in oil-industry spending plans as the price of crude does have influence in oil-industry spending plans.
"When they did, the firm reduced those stock holdings to about 70%.","When they did add another 5% Monday, the firm reduced those stock holdings to about 70%."
"John left, didn’t he?","John left, didn’t he he leave?"
"Arizona elected Goldwater Senator, and Pennsylvania Schwelker.","Arizona elected Goldwater Senator, and Pennsylvania elected Schwelker Senator."
"But the magazine was slower than its competitors to come up with its regional editions, and until last year offered fewer of them than did competitors.","But the magazine was slower than its competitors to come up with its regional editions, and until last year offered fewer of them than did competitors offer."
"John's phone is purple, and Mary's is blue.","John's phone is purple, and Mary's phone is blue."
"There are no price wars, no competition.","There are no price wars, there is no competition."
"NOW YOU SEE IT, now you don't.","NOW YOU SEE IT, now you don't see it."
"Fred likes to pet the cat, and Sally the dog.","Fred likes to pet the cat, and Sally likes to pet the dog."
"Signs of a slowing economy are increasing pressure on the Federal Reserve to cut short-term interest rates, but it isn't clear whether the central bank will do so.","Signs of a slowing economy are increasing pressure on the Federal Reserve to cut short-term interest rates, but it isn't clear whether the central bank will do so cut short-term interest rates."
Irving maintained--and still does --that its actions were proper under its account agreements with customers.,Irving maintained--and still does maintaine--that its actions were proper under its account agreements with customers.
"On days when prices are tumbling, they must be willing to buy shares from sellers when no one else will.","On days when prices are tumbling, they must be willing to buy shares from sellers when no one else will buy shares from sellers."
"""We feel we are doing everything we can,"" an Occidental spokesman says.","""We feel we are doing everything we can do,"" an Occidental spokesman says."
"The less complicated version of playing tunes on bells, as do the carillons of continental Europe, is considered by the English to be childish, fit only for foreigners.","The less complicated version of playing tunes on bells, as do play tunes on bells the carillons of continental Europe, is considered by the English to be childish, fit only for foreigners."
"He notes that program traders have a commission cost advantage because of the quantity of their trades, that they have a smaller margin requirement than individual investors do and that they often can figure out earlier where the market is heading.","He notes that program traders have a commission cost advantage because of the quantity of their trades, that they have a smaller margin requirement than individual investors do have a margin requirement and that they often can figure out earlier where the market is heading."
"Why did Sam call, and Bill too?","Why did Sam call, and why did Bill call too?"
"Pictures of friends should make you smile, and of enemies frown.","Pictures of friends should make you smile, and pictures of enemies should make you frown."
"In particular, Mr. Coxon says, businesses are paying out a smaller percentage of their profits and cash flow in the form of dividends than they have historically.","In particular, Mr. Coxon says, businesses are paying out a smaller percentage of their profits and cash flow in the form of dividends than they have paid out historically."
"But there's a chance we might,"" said David Wilson, head of Penn Mutual's $100 million stock portfolio.","But there's a chance we might blacklist firms,"" said David Wilson, head of Penn Mutual's $100 million stock portfolio."
"Did Frank get married first, or Larry?","Did Frank get married first, or did Larry get married first?"
I want her to win and him to lose.,I want her to win and I want him to lose.
"In the third quarter, for example, junk bonds--those with less than an investment-grade rating--showed negative returns, the only major sector of the bond market to do so.","In the third quarter, for example, junk bonds--those with less than an investment-grade rating--showed negative returns, the only major sector of the bond market to show negative returns."
"Some ate bread, and others rice.","Some ate bread, and others ate rice."
My wife wants to buy a car and my son a motorcycle.,My wife wants to buy a car and my son wants to buy a motorcycle
"In 1980, 18% of federal prosecutions concluded at trial; in 1987, only 9% did.","In 1980, 18% of federal prosecutions concluded at trial; in 1987, only 9% of federal prosecutions did conclude at trial."
"Peter was talking with someone, but I don’t know whom.","Peter was talking with someone, but I don’t know with whom he was talking."
If human beings can't cut federal spending honestly--and they can't --let the computers do it.,If human beings can't cut federal spending honestly--and they can't cut federal spending--let the computers do it.
"Talks between the two sides could unravel, of course, as they have more than once since Sony announced its plans to hire Mr. Guber and Mr. Peters.","Talks between the two sides could unravel, of course, as they have more than once unraveled since Sony announced its plans to hire Mr. Guber and Mr. Peters."
"If he brings his dog, I'll bring mine too.","If he brings his dog, I'll bring my dog too."
The first train and the second have arrived.,The first train and the second train have arrived.
They also said that vendors were delivering goods more quickly in October than they had for each of the five previous months.,They also said that vendors were delivering goods more quickly in October than they had delivered goods for each of the five previous months.
Billy.,Billy has been hiding the truth.
"She played soccer, and I did too.","She played soccer, and I did play soccer too."
"Bell Atlantic posted a strong earnings gain for the third quarter, as did Southern New England Telecommunications.","Bell Atlantic posted a strong earnings gain for the third quarter, as did Southern New England Telecommunications post a strong earnings gain for the third quarter."
"John I haven’t met, but Petra I have.","John I haven’t met, but Petra I have met."
"Last year, John had an office in Leiden and Peter in Nijmegen.","Last year, John had an office in Leiden and last year Peter had an office in Nijmegen."
"It's hard to accept all the suffering people are going through, but you have to.","It's hard to accept all the suffering people are going through, but you have to accept all the suffering people are going through."
"Sit down again, and let me explain why.","Sit down again, and let me explain why he will vote for the corrupt measure."
"Then the whole thing will start to collapse, just as it did in the 1970s, and the ghosts and banshees will be howling through the place turning people's hair white.","Then the whole thing will start to collapse, just as it did collapse in the 1970s, and the ghosts and banshees will be howling through the place turning people's hair white."
"Since production costs were guaranteed, it didn't matter that a program couldn't be sold abroad or put into syndication, as most American programs are.","Since production costs were guaranteed, it didn't matter that a program couldn't be sold abroad or put into syndication, as most American programs are sold abroad."
"During the takeover, Mr. Hahn said he would put his account up for review if WPP's bid were successful, but he didn't.","During the takeover, Mr. Hahn said he would put his account up for review if WPP's bid were successful, but he didn't put his account up for review."
Charles scratched his arm and Devin did too.,"Charles scratched his arm and Devin scratched his arm, too."
"Mary was studying all night, and I should have been, too.","Mary was studying all night, and I should have been studying all night, too."
"Chris said yesterday that he knew it, and today too.","Chris said yesterday that he knew it, and he said today that he knew it too."
In fact it does the opposite.,In fact it does generate the opposite.
"Third and most important, Amex would charge me a far higher premium than other reputable companies would on a straight term policy for the same amount; I'd be paying so heavily just to have the option of getting my premiums back that I'd almost have to cancel to make the whole thing worthwhile.","Third and most important, Amex would charge me a far higher premium than other reputable companies would charge on a straight term policy for the same amount; I'd be paying so heavily just to have the option of getting my premiums back that I'd almost have to cancel to make the whole thing worthwhile."
"In doing so, he neither rejected a socialist planned economy nor embraced the free market.","In presenting his economic vision to the Soviet Congress, he neither rejected a socialist planned economy nor embraced the free market."
"People got rich through takeovers in those days, as they do today.","People got rich through takeovers in those days, as they do get rich through takeovers today."
"IF IN VITRO fertilization works, it usually does so after only a few tries.","IF IN VITRO fertilization works, it usually does work after only a few tries."
"IBM, though long a leader in the Japanese mainframe business, didn't introduce its first PC in Japan until five years after NEC did, and that wasn't compatible even with the U.S. IBM standard.","IBM, though long a leader in the Japanese mainframe business, didn't introduce its first PC in Japan until five years after NEC did introduce its first PC in Japan, and that wasn't compatible even with the U.S. IBM standard."
"Should I call you, or you me?","Should I call you, or should you call me?"
They didn't.,"They didn't end up like a friend of theirs who'd applied for a visa and waited for 10 years, having been demoted from his profession of theoretical mathematician to shipping clerk."
"Lauren can play five instruments, and Mike can play six.","Lauren can play five instruments, and Mike can play six instruments."
"The man stole the car after midnight, but not the diamonds.","The man stole the car after midnight, but did not steal the diamonds."
"More stable industries were to build an economically viable infrastructure for the Moon movement in North America, as they had in Japan and South Korea.","More stable industries were to build an economically viable infrastructure for the Moon movement in North America, as they had built an economically viable infrastructure for the Moon movement in Japan and South Korea."
"All of which has enabled those of us in Washington who enjoy wallowing in such things to go into high public dudgeon, as Mr. Apple and I did the other night on ABC's ""Nightline.""","All of which has enabled those of us in Washington who enjoy wallowing in such things to go into high public dudgeon, as Mr. Apple and I did go into high public dudgeon the other night on ABC's ""Nightline."""
"Investors switched trading focus quickly as they did Tuesday, reflecting uncertainty about long-term commitments to any issue or sector, traders said.","Investors switched trading focus quickly as they did switch trading focus Tuesday, reflecting uncertainty about long-term commitments to any issue or sector, traders said."
"First, economists James Bennett and Thomas DiLorenzo find that GOP senators turn back roughly 10% more of their allocated personal staff budgets than Democrats do.","First, economists James Bennett and Thomas DiLorenzo find that GOP senators turn back roughly 10% more of their allocated personal staff budgets than Democrats do turn back of their allocated personal staff budgets."
"The rationale for responding to your customers' needs faster than the competition can is clear: Your company will benefit in terms of market share, customer satisfaction and profitability.","The rationale for responding to your customers' needs faster than the competition can respond to customers' needs is clear: Your company will benefit in terms of market share, customer satisfaction and profitability."
Why did you leave but didn’t tell me?,Why did you leave but you didn’t tell me?
"Her Susie Diamond handles a song the way the greats do, like she's hearing the way it should sound inside her head and she's concentrating on matching that internal tone.","Her Susie Diamond handles a song the way the greats do handle a song, like she's hearing the way it should sound inside her head and she's concentrating on matching that internal tone."
It is widely expected that they will.,It is widely expected that they will follow suit.
"The question is, if group conflicts still exist (as undeniably they do), and if Mr. Mason's type of ethnic humor is passe, then what other means do we have for letting off steam?","The question is, if group conflicts still exist (as undeniably they do exist), and if Mr. Mason's type of ethnic humor is passe, then what other means do we have for letting off steam?"
"Most dogs can smell fear, but Sparky could not.","Most dogs can smell fear, but Sparky could not smell fear."
I want to try to begin to write a novel and Mary to write a play.,I want to try to begin to write a novel and Mary wants to try to begin to write a play.
"If he does not, he will help realize Madison's fear in The Federalist No. 48 of a legislature ""everywhere extending the sphere of its activity and drawing all powers into its impetuous vortex.""","If he does not set things straight, he will help realize Madison's fear in The Federalist No. 48 of a legislature ""everywhere extending the sphere of its activity and drawing all powers into its impetuous vortex."""
"In the event that the buy-out group stalls in reviving its bid, the UAL board could remain under some pressure to seek another transaction, even without any legal obligation to do so.","In the event that the buy-out group stalls in reviving its bid, the UAL board could remain under some pressure to seek another transaction, even without any legal obligation to seek another transaction."
"Doubtless it still exists, but only the thief knows where.","Doubtless it still exists, but only the thief knows where it exists."
"But although Thurber did so gently and lightheartedly, many of Dr. Morgan's supporters have taken Thurber's memorable title ""The Male Animal"" quite literally.","But although Thurber did caricature it as ""the war between the sexes"" gently and lightheartedly, many of Dr. Morgan's supporters have taken Thurber's memorable title ""The Male Animal"" quite literally."
The man who didn’t leave knows the man who did.,The man who didn’t leave knows the man who did leave.
"I want to try to begin to write a novel, and Mary to begin to write a play.","I want to try to begin to write a novel, and Mary to try to begin to write a play."
"Mary will dine soup, and Peter will, too.","Mary will dine soup, and Peter will dine soup, too."
"I was helpful this time, and you too.","I was helpful this time, and you were helpful this time too."
"Some analysts have said Courtaulds' moves could boost the company's value by 5% to 10%, because the two entities separately will carry a higher price earnings multiple than they did combined.","Some analysts have said Courtaulds' moves could boost the company's value by 5% to 10%, because the two entities separately will carry a higher price earnings multiple than they did combined carry price earnings."
"I seemed to believe the boy, I didn't know why.","I seemed to believe the boy, I didn't know why I believed the boy."
I want to try to begin to write a novel and Mary to try to begin to write a play.,I want to try to begin to write a novel and Mary wants to try to begin to write a play.
"The thriving 34th Street area offers rents of about $100 a square foot, as do up-and-coming locations along lower Fifth Avenue.","The thriving 34th Street area offers rents of about $100 a square foot, as do up-and-coming locations along lower Fifth Avenue offer."
"If I lived in Paris, I would be a poet, but I don't, so I won't.","If I lived in Paris, I would be a poet, but I don't live in Paris, so I won't be a poet."
Susan likes her big red fish with a stripe and Tom likes his too.,Susan likes her big red fish with a stripe and Tom likes his big red fish with a stripe too.
"If bluebloods won't pay high prices for racehorses anymore, who will?","If bluebloods won't pay high prices for racehorses anymore, who will pay high prices for racehorses?"
Why did you leave but didn’t tell me?,Why did you leave but didn’t you tell me?
They say insurance companies use policies aimed at excluding bad risks because their competitors do.,They say insurance companies use policies aimed at excluding bad risks because their competitors do use policies aimed at excluding bad risks.
"If takeover premiums become excessive, if LBO dealmakers become too aggressive, then the private market will recognize these problems more quickly and accurately than will policy makers, and the markets will move with lightning speed to impose appropriate sanctions.","If takeover premiums become excessive, if LBO dealmakers become too aggressive, then the private market will recognize these problems more quickly and accurately than will policy makers recognize, and the markets will move with lightning speed to impose appropriate sanctions."
"As a result, many economists were expecting the consumer price index to increase significantly more than it did.","As a result, many economists were expecting the consumer price index to increase significantly more than it did increase."
Poland produces about 20 times more soot and five times more sulfur dioxide and solid waste per unit of gross national product than does Western Europe.,Poland produces about 20 times more soot and five times more sulfur dioxide and solid waste per unit of gross national product than does Western Europe produce.
"I want to try to begin to write a novel, and Mary to try to begin to draft.","I want to try to begin to write a novel, and Mary to try to begin to draft a play."
"As they did when the Philippines was a colony of the U.S., teachers for the most part teach in English, even though it is a foreign language for most Philippine children.","As they did teach in English when the Philippines was a colony of the U.S., teachers for the most part teach in English, even though it is a foreign language for most Philippine children."
"European multinationals do likewise; even in America, their affiliates are usually run by American managers.","European multinationals do likewise place native or native speakers in charge of subsidiaries overseas; even in America, their affiliates are usually run by American managers."
"Boober should have eaten, shouldn’t he have?","Boober should have eaten, shouldn’t he have eaten?"
"Both banks have been battered, as have other Arizona banks, by falling real estate prices.","Both banks have been battered, as have other Arizona banks been battered, by falling real estate prices."
"Although Mr. Azoff won't produce films at first, it is possible that he could do so later, the sources said.","Although Mr. Azoff won't produce films at first, it is possible that he could do produce films later, the sources said."
"To reduce the danger of such pricing cycles, Akzo has invested heavily in specialty chemicals, which have highly specific industrial uses and tend to produce much higher profit margins than do bulk chemicals.","To reduce the danger of such pricing cycles, Akzo has invested heavily in specialty chemicals, which have highly specific industrial uses and tend to produce much higher profit margins than do bulk chemicals produce profit margins."
"Comsat Video, which distributes pay-per-view programs to hotel rooms, plans to add Nuggets games to their offerings, as Mr. Turner did successfully with his Atlanta Hawks and Braves sports teams.","Comsat Video, which distributes pay-per-view programs to hotel rooms, plans to add Nuggets games to their offerings, as Mr. Turner did successfully add Nuggets games to his offerings with his Atlanta Hawks and Braves sports teams."
"She did it first, and him too.","She did it first, and he did it too."
"The bill also would give the SEC the power to close the markets, a discretion that former SEC Chairman David Ruder wanted but Mr. Breeden doesn't.","The bill also would give the SEC the power to close the markets, a discretion that former SEC Chairman David Ruder wanted but Mr. Breeden doesn't want."
"Beth’s nuptials were in Bond Chapel, and Rachel’s were in Rockefeller Chapel.","Beth’s nuptials were in Bond Chapel, and Rachel’s nuptials were in Rockefeller Chapel."
"""We would stop index arbitrage when the market is under stress, and we have recently,"" he said, citing Oct. 13 and earlier this week.","""We would stop index arbitrage when the market is under stress, and we have recently stopped index arbitrage,"" he said, citing Oct. 13 and earlier this week."
"Sharon could probably pull a muscle doing that, couldn’t she?","Sharon could probably pull a muscle doing that, couldn’t she pull a muscle doing that?"
"American Enterprise Institute scholar Norman Ornstein in the Oct. 21 TV Guide on ""What TV News Doesn't Report About Congress--and Should "":","American Enterprise Institute scholar Norman Ornstein in the Oct. 21 TV Guide on ""What TV News Doesn't Report About Congress--and Should Report About Congress"":"
They lie - that's how.,They lie - that's how they say you're rich.
She saw every animal at the zoo but he saw only some.,She saw every animal at the zoo but he saw only some animals.
"He will read the book, and she will, too.","He will read the book, and she will read the book, too."
"The arbs may recoup some of their paper losses if the UAL deal gets patched up again, as they did in 1982 when Occidental Petroleum Co. rescued them with a $4 billion takeover of Cities Service.","The arbs may recoup some of their paper losses if the UAL deal gets patched up again, as they did recoup some of their paper losses in 1982 when Occidental Petroleum Co. rescued them with a $4 billion takeover of Cities Service."
And Bengali?,Did John meet a woman who speaks French and Bengali?
"Some school kids like syntax, and some don't like syntax.","Some school kids like syntax, and some school kids don't like syntax."
"Ivan plays krummhorn, Boris fluegelhorn, and Schwarz bassethorn.","Ivan plays krummhorn, Boris plays fluegelhorn, and Schwarz plays bassethorn."
Certainly I do not.,Certainly I do not have a worthwhile opinion on the underlying merits of the controversy.
"Lauren can play the guitar, and Mike as well.","Lauren can play the guitar, and Mike can play the guitar as well."
"Even for people who expect a bear market in coming months--and a sizable number of money managers and market pundits do --the advice is: Wait for the market to bounce back, and sell shares gradually during rallies.","Even for people who expect a bear market in coming months--and a sizable number of money managers and market pundits do expect a bear market in coming months--the advice is: Wait for the market to bounce back, and sell shares gradually during rallies."
"I want to try to begin to write a novel, and Mary to begin a play.","I want to try to begin to write a novel, and Mary to try to begin to write a play."
I visited everyone that you did.,I visited everyone that you did visit.
"Enough inflation can ultimately even wipe out the bond market, as it did in Britain in the 1970s, thereby crippling the economy.","Enough inflation can ultimately even wipe out the bond market, as it did wipe out the bond market in Britain in the 1970s, thereby crippling the economy."
Pro.,Sviatoslav is pro-communist these days.
They are worth more because they pay higher interest than newly issued bonds do.,They are worth more because they pay higher interest than newly issued bonds do pay interest.
Hey?—how’s that?,Hey?—how’s that they say I'm rich?
He cleaned the apartment although he didn’t want to.,He cleaned the apartment although he didn’t want to clean the apartment.
"""I'd love to see sports cut back, and so would a lot of my counterparts at other schools, but everybody's afraid to make the first move,"" he confided.","""I'd love to see sports cut back, and so would a lot of my counterparts at other schools love to see sports cut back, but everybody's afraid to make the first move,"" he confided."
It's a matter of being close to those suppliers; many of those companies don't know us as well as they should.,It's a matter of being close to those suppliers; many of those companies don't know us as well as they should know us.
