If foreigners dump U.S. stocks and return to the safety of their home markets--as they did in October 1987--they must simultaneously also sell dollars for their own currencies.,If foreigners dump U.S. stocks and return to the safety of their home markets--as they did dump U.S. stocks and return to the safety of their home markets in October 1987--they must simultaneously also sell dollars for their own currencies.
The driver was killed and the passenger severely wounded.,The driver was killed and the passenger was severely wounded.
Do you think the British know something that we don't?,Do you think the British know something that we don't know?
"I expect you to help, and you me.","I expect you to help, and you expect me to help."
"Even the Soviet Union has Peter the Great to rediscover, should it choose to.","Even the Soviet Union has Peter the Great to rediscover, should it choose to rediscover Peter the Great."
"My sister lives in Utrecht and my brother, too.","My sister lives in Utrecht and my brother lives in Utrecht, too."
"There are few prospects for upward mobility, and Mr. Li's daughter, seven-year-old Li Shu, is certain to toil at the factory too someday, as are more than 10,000 of the workers' children.","There are few prospects for upward mobility, and Mr. Li's daughter, seven-year-old Li Shu, is certain to toil at the factory too someday, as are more than 10,000 of the workers' children to toil at the factory."
"On Friday, the market makers, who must be prepared to buy stock when no one else will, were frantically cutting the prices at which they would take stocks off sellers' hands, in reaction to plunging prices on the New York Stock Exchange, according to Mr. Rosenbach.","On Friday, the market makers, who must be prepared to buy stock when no one else will buy stock, were frantically cutting the prices at which they would take stocks off sellers' hands, in reaction to plunging prices on the New York Stock Exchange, according to Mr. Rosenbach."
"He says that the Chinese never asked him to convey their statements to President Bush, but that the White House spontaneously invited him to do so.","He says that the Chinese never asked him to convey their statements to President Bush, but that the White House spontaneously invited him to do convey their statements to President Bush."
"As the West German currency rose, so did Merkur prices.","As the West German currency rose, so did Merkur prices rise."
"When Susan brings her dog, Sam brings his dog too.","When Susan brings her dog, Sam brings his ___ too."
"She will high-five Daniel, but she won’t Samson.","She will high-five Daniel, but she won’t high-five Samson."
"When they did, his commanders didn't have the initiative to do more than block a couple of roads.","When they did move against Mr. Noriega, his commanders didn't have the initiative to do more than block a couple of roads."
"To do so, Bull is planting itself firmly in the U.S., where, says Mr. Lorentz, a lot of the best people and research are.","To do survive the 1990s, Bull is planting itself firmly in the U.S., where, says Mr. Lorentz, a lot of the best people and research are."
"I thought and, I'm sure, others did: ""You shouldn't have bothered.""","I thought and, I'm sure, others did think: ""You shouldn't have bothered."""
"IBM, Armonk, N.Y., said it wanted to bring out the mainframes as soon as it could to spark as many sales as possible by the end of the year.","IBM, Armonk, N.Y., said it wanted to bring out the mainframes as soon as it could bring out the mainframes to spark as many sales as possible by the end of the year."
"""By encouraging massive, routine, voluntary testing we can enable society to voluntarily segregate itself sexually into two groups: those who carry the virus and those who do not,"" the Indianapolis research organization said in a new report.","""By encouraging massive, routine, voluntary testing we can enable society to voluntarily segregate itself sexually into two groups: those who carry the virus and those who do not carry the virus,"" the Indianapolis research organization said in a new report."
They still are.,They still are angry.
"And they will again, say money-manager proponents of the growth-stock theme.","And they will again flock to the shares of companies with proven earnings records, say money-manager proponents of the growth-stock theme."
"Peter was talking with someone, but I don’t know who.","Peter was talking with someone, but I don’t know with whom he was talking."
He was particularly happy that they would broadcast eight Chiefs games and eight with the Jets.,He was particularly happy that they would broadcast eight Chiefs games and eight games with the Jets.
"But as stock prices recovered some of the early losses, so did the U.S. currency.","But as stock prices recovered some of the early losses, so did the U.S. currency recover."
"Without this basic level of attention to reality, our policies on Cuba will continue to be as counterproductive as they have for 30 years.","Without this basic level of attention to reality, our policies on Cuba will continue to be as counterproductive as they have been counterproductive for 30 years."
"Lauren can play five instruments, and Mike can play six.","Lauren can play five instruments, and Mike can play six instruments."
Indeed it is.,Indeed it is a problem.
"Wednesday's report from the purchasing agents will be watched to see if the index maintains a level below 50%, as it has for the past couple of months.","Wednesday's report from the purchasing agents will be watched to see if the index maintains a level below 50%, as it has maintained for the past couple of months."
"If President Bush fails to do so in his first year, he will invite Congress, for the remainder of his presidency, to rewrite Article II of the Constitution to suit its purposes.","If President Bush fails to do so veto appropriations acts in his first year, he will invite Congress, for the remainder of his presidency, to rewrite Article II of the Constitution to suit its purposes."
"Analysts said the company's effort will be helped by its decision last year to put point-of-sale scanners in 200 stores, allowing National Convenience to quickly track items that are selling and those that aren't.","Analysts said the company's effort will be helped by its decision last year to put point-of-sale scanners in 200 stores, allowing National Convenience to quickly track items that are selling and those that aren't selling."
"One was Pilgrim’s Progress, about a man that left his family, it didn’t say why.","One was Pilgrim’s Progress, about a man that left his family, it didn’t say why the man left his family."
"Moreover, Japanese offices tend to use computers less efficiently than American offices do.","Moreover, Japanese offices tend to use computers less efficiently than American offices do use computers efficiently."
You sunk just about as low as NBC did in its reporting on Korean life during last year's Olympics.,You sunk just about as low as NBC did sink in its reporting on Korean life during last year's Olympics.
"Officials there declined to comment, as did Helmsley management.","Officials there declined to comment, as did Helmsley management decline to comment."
"Two of three Japanese employees submit suggestions to save money, increase efficiency and boost morale, while only 8% of American workers do.","Two of three Japanese employees submit suggestions to save money, increase efficiency and boost morale, while only 8% of American workers do submit suggestions to save money, increase efficiency and boost morale."
I want to try to begin to write a novel and Mary a play.,I want to try to begin to write a novel and Mary wants to try to begin to write a play.
I give you my word.,I give you my word I will come back from the errand.
"She knows a guy who has five dogs, but I don’t know how many cats.","She knows a guy who has five dogs, but I don’t know how many cats the guy has."
"All of their friends have children and they can't, so now they want a child more than anything--perhaps even more than Michael wanted his fancy convertible or his deluxe stereo equipment.","All of their friends have children and they can't have children, so now they want a child more than anything--perhaps even more than Michael wanted his fancy convertible or his deluxe stereo equipment."
"""If I can show signs of maturity, almost anybody can,"" he jokes.","""If I can show signs of maturity, almost anybody can show signs of maturity,"" he jokes."
"If you bought, you wish you hadn't, and if you sold, you wish you hadn't.","If you bought, you wish you hadn't bought, and if you sold, you wish you hadn't sold."
"Nervousness that the market hasn't seen the last of its recent volatility kept trading at a moderate pace, as did anticipation of a report on the economy's third-quarter performance.","Nervousness that the market hasn't seen the last of its recent volatility kept trading at a moderate pace, as did anticipation of a report on the economy's third-quarter performance keep trading at a moderate pace."
A Japanese apple called the Fuji is cropping up in orchards the way Hondas did on U.S. roads.,A Japanese apple called the Fuji is cropping up in orchards the way Hondas did crop up on U.S. roads.
"""He would,"" agrees the chairman.","""He would be taking grave political risks,"" agrees the chairman."
"""A lot of people think I will give away the store, but I can assure you I will not,"" he says.","""A lot of people think I will give away the store, but I can assure you I will not give away the store,"" he says."
"Shearson, Merrill Lynch and Goldman Sachs say they do so only for customers, however.","Shearson, Merrill Lynch and Goldman Sachs say they do program-trade OTC stocks only for customers, however."
"Lauren can play the guitar and Mike can, too.","Lauren can play the guitar and Mike can play the guitar, too."
"But from early on, Tiger's workers unionized, while Federal's never have.","But from early on, Tiger's workers unionized, while Federal's never have unionized."
"I stole a book, and Peter kisses from Mary.","I stole a book from Mary, and Peter stole kisses from Mary."
"He did, too late to save Mr. Carter from forced retirement.","He did kill inflation, too late to save Mr. Carter from forced retirement."
"So far, they've been unable to do so.","So far, they've been unable to justify it scientifically."
Henk lives in Leiden and Chris in Delft,Henk lives in Leiden and Chris lives in Delft
"Big cyclical companies are using ""all the tricks they can to stabilize earnings,"" says Mr. Sloan.","Big cyclical companies are using ""all the tricks they can use to stabilize earnings,"" says Mr. Sloan."
"Federal Reserve Chairman Alan Greenspan was on the telephones, making it clear to officials in the U.S. and abroad that the Fed was prepared to inject massive amounts of money into the banking system, as it did in October 1987, if the action were needed to prevent a financial crisis.","Federal Reserve Chairman Alan Greenspan was on the telephones, making it clear to officials in the U.S. and abroad that the Fed was prepared to inject massive amounts of money into the banking system, as it did inject massive amounts of money into the banking system in October 1987, if the action were needed to prevent a financial crisis."
"They had left the company, many for good.","They had left the company, many left for good."
Mr. Sim is confident that the drive to dominate certain niche markets will work at Barry Wright as it has at Applied.,Mr. Sim is confident that the drive to dominate certain niche markets will work at Barry Wright as it has worked at Applied.
"Pizza Hole is being inspected, isn’t it?","Pizza Hole is being inspected, isn’t it being inspected?"
This bill simply says that if you want to develop property on a barrier island you have to do so without taxpayer support.,This bill simply says that if you want to develop property on a barrier island you have to develop property on a barrier island without taxpayer support.
"Lauren can play something, but I don’t know what.","Lauren can play something, but I don’t know what Lauren can play."
"It may seem trivial to worry about the World Series amid the destruction to the Bay Area wrought by Tuesday's quake, but the name of this column is ""On Sports,"" so I feel obliged to do so.","It may seem trivial to worry about the World Series amid the destruction to the Bay Area wrought by Tuesday's quake, but the name of this column is ""On Sports,"" so I feel obliged to worry about the World Series."
"""The only people who are flying are those who have to,"" said Frank Moore, chairman of the Australian Tourist Industry Association.","""The only people who are flying are those who have to fly,"" said Frank Moore, chairman of the Australian Tourist Industry Association."
"Because the markets remained relatively calm, however, the Fed didn't have to inject massive amounts of money into the banking system, as it did in October 1987.","Because the markets remained relatively calm, however, the Fed didn't have to inject massive amounts of money into the banking system, as it did remain relatively calm in October 1987."
"The group says standardized achievement test scores are greatly inflated because teachers often ""teach the test"" as Mrs. Yeargin did, although most are never caught.","The group says standardized achievement test scores are greatly inflated because teachers often ""teach the test"" as Mrs. Yeargin did teach the test, although most are never caught."
So far no one has.,So far no one has analyzed that.
When?,When will you be back from the errand?
"Many are quick to emphasize that just because the market can fall as fast as it did Friday doesn't mean it will tank again, despite some disquieting similarities between now and October 1987.","Many are quick to emphasize that just because the market can fall as fast as it did fall Friday doesn't mean it will tank again, despite some disquieting similarities between now and October 1987."
And returns on cash investments may continue to exceed inflation by a wider margin than they did over the long-term past.,And returns on cash investments may continue to exceed inflation by a wider margin than they did exceed inflation over the long-term past.
"Officers of the company, a health-care concern, ""were very discouraged on Friday and felt they shouldn't go public; we felt they should,"" says Sanford Robertson, partner in the banking concern.","Officers of the company, a health-care concern, ""were very discouraged on Friday and felt they shouldn't go public; we felt they should go public,"" says Sanford Robertson, partner in the banking concern."
"If it does not quite have Chandler's special magic--well, at the end, neither did Chandler.","If it does not quite have Chandler's special magic--well, at the end, neither did Chandler have special magic."
I got it out of the nineteenth century where they know how.,I got it out of the nineteenth century where they know how to make a hair-lifting soul-scorching thirteen-jointed insult.
"If she remains influential with Mr. Dinkins, as some suggest she will, his mayoralty may take on a more anti-development flavor.","If she remains influential with Mr. Dinkins, as some suggest she will remain influential with Mr. Dinkins, his mayoralty may take on a more anti-development flavor."
"Even though he skipped one, he did do the rest of the tasks.","Even though he skipped one task, he did do the rest of the tasks."
"Simon quickly dropped the gold, and Jack the diamonds.","Simon quickly dropped the gold, and Jack quickly dropped the diamonds."
"Ben might shower, but Jack can’t shower or Austin get dressed.","Ben might shower, but Jack can’t shower or Austin can't get dressed."
"""If you're going to be consistent and say it is a constitutionally protected right,"" he asks, ""how are you going to say an upscale woman who can drive to the hospital or clinic in a nice car has a constitutional right and someone who is not in great shape financially does not?""","""If you're going to be consistent and say it is a constitutionally protected right,"" he asks, ""how are you going to say an upscale woman who can drive to the hospital or clinic in a nice car has a constitutional right and someone who is not in great shape financially does not have a constitutional right?"""
"The bank was in touch with other major central banks over the weekend and was preparing to make capital available to dealers if needed, as it did in the 1987 crash, according to people familiar with the bank's strategy.","The bank was in touch with other major central banks over the weekend and was preparing to make capital available to dealers if needed, as it did make capital available to dealers in the 1987 crash, according to people familiar with the bank's strategy."
An NEC spokeswoman responds that prices are higher in Japan because customers put a greater emphasis on quality and service than they do in the U.S.,An NEC spokeswoman responds that prices are higher in Japan because customers put a greater emphasis on quality and service than they do put an emphasis on quality and service in the U.S.
Sam.,I called Sam.
"American Brands ""just had a different approach,"" Mr. Wathen says. ""Their approach didn't work; mine is.""","American Brands ""just had a different approach,"" Mr. Wathen says. ""Their approach didn't work; mine is working."""
"Judy should have been fired, shouldn’t she have been?","Judy should have been fired, shouldn’t she have been fired?"
"Mr. Wilder did introduce such legislation 17 years ago, but he did so at the request of a constituent, a common legislative technique used by lawmakers.","Mr. Wilder did introduce such legislation 17 years ago, but he did so introduce the legislation at the request of a constituent, a common legislative technique used by lawmakers."
"While rights fees head skyward, ad rates won't.","While rights fees head skyward, ad rates won't head skyward."
"Many institutional index funds are active program traders, swapping their stocks for futures when profitable to do so.","Many institutional index funds are active program traders, swapping their stocks for futures when profitable to do swap their stocks."
"She will hive-five Daniel, but I won’t.","She will hive-five Daniel, but I won’t high five Daniel."
"So are Indiana, Ohio and Michigan.","So are Indiana, Ohio and Michigan making a comeback."
"He has made a cake, and she has, too.","He has made a cake, and she has made a cake, too."
Jill likes your story even though she hates Bill's.,Jill likes your story even though she hates Bill's story.
"Everyone that Kevin did, Jorge thought he kissed.","Everyone that Kevin did kiss, Jorge thought he kissed."
"Yes, but Jack saw more horses than Eric saw.","Yes, but Jack saw more horses than Eric saw horses."
"Doug should take a vow of silence, and Nick should, too.","Doug should take a vow of silence, and Nick should take a vow of silence, too."
"Composer Marc Marder, a college friend of Mr. Lane's who earns his living playing the double bass in classical music ensembles, has prepared an exciting, eclectic score that tells you what the characters are thinking and feeling far more precisely than intertitles, or even words, would.","Composer Marc Marder, a college friend of Mr. Lane's who earns his living playing the double bass in classical music ensembles, has prepared an exciting, eclectic score that tells you what the characters are thinking and feeling far more precisely than intertitles, or even words, would tell you what the characters are thinking and feeling."
"And I said, 'You will.'","And I said, 'You will run for borough president.'"
"""If we had, it might have scared us off,"" he says.","""If we had done any due diligence, it might have scared us off,"" he says."
"And if you are caught or if people complain, simply argue that ""everyone does it"" or ""no one said I shouldn't "" and brazen it out.","And if you are caught or if people complain, simply argue that ""everyone does it"" or ""no one said I shouldn't do it"" and brazen it out."
"Thankfully, he didn’t.","Thankfully, he didn’t come to the party."
"No, about foreign policy.","No, each candidate will talk about foreign policy."
"If it does, the large number of right-wing whites, who oppose any concessions to the black majority, will step up their agitation and threats to take matters into their own hands.","If it does yield on these matters, the large number of right-wing whites, who oppose any concessions to the black majority, will step up their agitation and threats to take matters into their own hands."
"The government is watching closely to see if their presence in the townships leads to increased anti-government protests and violence; if it does, Pretoria will use this as a reason to keep Mr. Mandela behind bars.","The government is watching closely to see if their presence in the townships leads to increased anti-government protests and violence; if it does lead to increased anti-government protests and violence, Pretoria will use this as a reason to keep Mr. Mandela behind bars."
"As Mr. Noriega's political troubles grew, so did his offers of assistance to the Contras, an apparent attempt to curry more favor in Washington.","As Mr. Noriega's political troubles grew, so did his offers of assistance to the Contras grow, an apparent attempt to curry more favor in Washington."
"While the theme is compelling, the plot and characters are not.","While the theme is compelling, the plot and characters are not compelling."
"A former executive agreed that the departures don't reflect major problems, adding: ""If you see any company that grows as fast as Reebok did, it is going to have people coming and going.""","A former executive agreed that the departures don't reflect major problems, adding: ""If you see any company that grows as fast as Reebok did grow, it is going to have people coming and going."""
"Mary hasn’t read that book, has she?","Mary hasn’t read that book, has she read the book?"
"I would be a poet if I lived in Paris, but I don't, so I won't.","I would be a poet if I lived in Paris, but I don't live in Paris, so I won't be a poet."
You ought to had your jaws boxed; I hain’t been so put out since I don’t know when.,You ought to had your jaws boxed; I hain’t been so put out since I don’t know when I been so put out.
"Just as Pope John Paul II did in Seoul last week, President Bush and members of Congress ought to tell Mr. Roh in no uncertain terms that this kind of behavior is unacceptable.","Just as Pope John Paul II did tell Mr. Roh in no uncertain terms that this kind of behavior is unacceptable in Seoul last week, President Bush and members of Congress ought to tell Mr. Roh in no uncertain terms that this kind of behavior is unacceptable."
"You are hungry, and me too.","You are hungry, and I am hungry too."
They worry that Mr. Breeden also will roll over when told to do so by the White House.,They worry that Mr. Breeden also will roll over when told to do roll over by the White House.
"""The sense is we would never be in a position again where everything works for us the way it did before,"" says Rod Eddington, Cathay's commercial director.","""The sense is we would never be in a position again where everything works for us the way it did work before,"" says Rod Eddington, Cathay's commercial director."
"""But my daughter couldn't, until she was too ill to take it.","""But my daughter couldn't get AZT, until she was too ill to take it."
"If you want, I will help you.","If you want me to help you, I will help you."
"But the Reagan administration thought otherwise, and so may the Bush administration.","But the Reagan administration thought otherwise, and so may the Bush administration think."
"Those sound like innocuous changes, but they're not.","Those sound like innocuous changes, but they're not innocuous changes."
"He believes her to know the answer, and she him.","He believes her to know the answer, and she believes him to know the answer."
"Yeah, some.","Yeah, I have some good ideas."
"He says that because Seita's profits are limited by government-controlled cigarette prices, he doesn't have the cash to diversify as heavily into food and drink as the U.S. concern has done.","He says that because Seita's profits are limited by government-controlled cigarette prices, he doesn't have the cash to diversify as heavily into food and drink as the U.S. concern has done diversified as heavily into food and drink."
"I want to try to begin to write a novel, and Mary a play.","I want to try to begin to write a novel, and Mary to try to begin to write a play."
"Either my sister will eat the cookies, or my brother the cake.","Either my sister will eat the cookies, or my brother will eat the cake."
"At least, they both speak with strong accents, as do Jackie and Maddie.","At least, they both speak with strong accents, as do Jackie and Maddie speak with strong accents."
"Sony uses mostly red and blue, with traces of yellow--and so does Justin, on the theory that kids prefer these colors.","Sony uses mostly red and blue, with traces of yellow--and so does Justin use mostly red and blue, with traces of yellow, on the theory that kids prefer these colors."
"The program-trading issue is heating up on Capitol Hill as it is on Wall Street, and several legislators want to grant the SEC the power to shut off the programs when trading becomes too volatile.","The program-trading issue is heating up on Capitol Hill as it is heating up on Wall Street, and several legislators want to grant the SEC the power to shut off the programs when trading becomes too volatile."
Connor.,Connor has not done his homework.
